"annotation_id","annotator","contenuto","created_at","emotion_labels","id","lead_time","tipo","updated_at"
52,"1","Titolo: Andare a fare compere mi mette a disagio

Ciao a tuttə, negli ultimi tempi ho vissuto abbastanza lontano dalla mia famiglia e dai miei affetti, puntualizzo perché credo sia stato quello il momento in cui mi sono ritrovatə a dover fare compere da solə e sentirmi tremendamente a disagio. 
Riesco solo al supermercato senza farmi pare, anzi devo dire che mi piace proprio fare la spesa. 
Ma da tutti quei negozi di altro tipo non riesco mai ad uscire con qualcosa, anche se ne ho necessità, entro ed esco quasi subito.
Vorrei tanto sentirmi a mio agio durante questi momenti e viverli in maniera normale.","2024-12-10T10:14:41.972126Z","[{""start"":8,""end"":48,""text"":""Andare a fare compere mi mette a disagio"",""labels"":[""Paura""]},{""start"":261,""end"":293,""text"":""sentirmi tremendamente a disagio"",""labels"":[""Paura""]},{""start"":525,""end"":609,""text"":""Vorrei tanto sentirmi a mio agio durante questi momenti e viverli in maniera normale"",""labels"":[""Aspettativa""]},{""start"":361,""end"":391,""text"":""mi piace proprio fare la spesa"",""labels"":[""Gioia""]}]",54,177.822,"post","2024-12-13T10:48:19.748961Z"

53,"1","E da cosa nasce questo disagio? Perché eri abituata a fare compere con i tuoi forse? Vorresti qualcuno che ti consigliasse?","2024-12-10T10:15:06.098488Z","[{""start"":0,""end"":31,""text"":""E da cosa nasce questo disagio?"",""labels"":[""Aspettativa""]},{""start"":32,""end"":84,""text"":""Perché eri abituata a fare compere con i tuoi forse?"",""labels"":[""Aspettativa""]},{""start"":85,""end"":123,""text"":""Vorresti qualcuno che ti consigliasse?"",""labels"":[""Aspettativa""]}]",55,20.708,"commento","2024-12-10T10:15:06.098488Z"

54,"1","A volte però sembra quasi che vi sforziate per trovare pare sempre più bizzarre. Ma fermarsi a riconsiderare le proprie scelte di vita no? O forse è meglio andare a vivere in un paese del terzo mondo... non saprei. Qui siamo proprio fuori dalla terapia più semplice.","2024-12-10T10:15:41.422155Z","[{""start"":84,""end"":138,""text"":""fermarsi a riconsiderare le proprie scelte di vita no?"",""labels"":[""Aspettativa""]}]",56,122.053,"commento","2024-12-13T10:49:15.664461Z"

55,"1","OP, da estranea a estraneə, mi dispiace per come ti senti.


E questo è tutto quello che si può dire. Il resto saranno osservazioni per cui potresti non essere prontə.



Purtroppo non si può aggiungere altro, e sembra che il messaggio sia stato scritto per sentirti dire questo, magari con parole più lunghe, senza voler intraprendere alcuna azione per star meglio.


Mancano informazioni. Dici solo (e molto, molto vagamente) in che situazioni ti senti a disagio, ma non in che modo, o in cosa consistano queste ""pare"".


È difficile aiutarti senza dettagli.


E se leggo bene, non chiedi nemmeno aiuti o consigli, ma dici solo come ti senti e come ti vorresti sentire. Il che rende difficile poter rispondere in qualunque altro modo.


Allungare il brodo del ""mi dispiace per come ti senti"" non mi sembrava il caso. Il sub si chiama ""psicologia"", non ""parole di conforto"". La psicologia presuppone obiettivi di salute mentale, contesto, e dettagli.","2024-12-10T10:16:59.965665Z","[{""start"":28,""end"":57,""text"":""mi dispiace per come ti senti"",""labels"":[""Tristezza""]}]",57,75.274,"commento","2024-12-10T10:16:59.965665Z"

56,"1","Se non sei a tuo agio neanche col tuo genere, difficile esserlo su cose più complesse. Sbaglio? Inizierei da li fossi in te","2024-12-10T10:17:35.789751Z","[{""start"":96,""end"":123,""text"":""Inizierei da li fossi in te"",""labels"":[""Aspettativa""]},{""start"":87,""end"":95,""text"":""Sbaglio?"",""labels"":[""Aspettativa""]}]",58,57.068,"commento","2024-12-11T10:04:39.818953Z"

57,"1","Titolo: Nuove amicizie

Ciao a tutti,sono una ragazza di 20 anni,e mi piacerebbe fare nuove amicizie nella comunità LGBTQ+,io sono Bi.
Ho un po' di difficoltà a farlo dal vivo,quindi sono qui per provare a conoscere persone online. 
Se qualcuno vuole chiacchierare,sarei felice di farlo.","2024-12-10T10:19:42.156689Z","[{""start"":265,""end"":286,""text"":""sarei felice di farlo"",""labels"":[""Gioia""]},{""start"":8,""end"":22,""text"":""Nuove amicizie"",""labels"":[""Aspettativa""]},{""start"":67,""end"":122,""text"":""mi piacerebbe fare nuove amicizie nella comunità LGBTQ+"",""labels"":[""Aspettativa""]},{""start"":135,""end"":175,""text"":""Ho un po' di difficoltà a farlo dal vivo"",""labels"":[""Paura""]},{""start"":183,""end"":230,""text"":""sono qui per provare a conoscere persone online"",""labels"":[""Aspettativa""]}]",59,58.902,"post","2024-12-10T10:19:42.156689Z"

58,"1","Titolo: Donne 40+: cosa vi fa matchare sulle app di dating?

Sto cercando di rendere il mio profilo su app di dating più attrattivo per il tipo di donne che vorrei conoscere (40+, femminili, acculturate). Sono femminile, di bell’aspetto, arguta e acculturata a mia volta, ma ho l’impressione che qualcosa non funzioni. Quindi, cosa vi spinge a fare match? E cosa a scartare? (Non sto cercando di sembrare una persona che non sono, ma solo di essere più approcciabile per poter entrare in contatto).","2024-12-10T10:20:22.989964Z","[{""start"":19,""end"":59,""text"":""cosa vi fa matchare sulle app di dating?"",""labels"":[""Aspettativa""]},{""start"":327,""end"":355,""text"":""cosa vi spinge a fare match?"",""labels"":[""Aspettativa""]},{""start"":356,""end"":374,""text"":""E cosa a scartare?"",""labels"":[""Aspettativa""]}]",60,38.953,"post","2024-12-10T10:20:22.989964Z"

59,"1","L’aspetto fisico, come nella vita reale…alla descrizione non do molto peso (a meno che non emerga una certa arroganza), preferisco la comunicazione diretta per farmi un’idea di una persona 
Comunque le difficoltà di match/incontri nelle app per donne sono la regola…purtroppo…","2024-12-10T10:20:48.501675Z","[{""start"":190,""end"":276,""text"":""Comunque le difficoltà di match\/incontri nelle app per donne sono la regola…purtroppo…"",""labels"":[""Tristezza""]}]",61,100.1,"commento","2024-12-13T10:51:43.114836Z"

60,"1","Su che app di dating ti trovi di solito? Anche quello purtroppo ho visto essere un dato utile da analizzare.","2024-12-10T10:21:01.619453Z","[{""start"":0,""end"":40,""text"":""Su che app di dating ti trovi di solito?"",""labels"":[""Aspettativa""]},{""start"":41,""end"":107,""text"":""Anche quello purtroppo ho visto essere un dato utile da analizzare"",""labels"":[""Tristezza""]}]",62,54.01,"commento","2024-12-11T10:14:15.812655Z"

61,"1","Titolo: Archivi della Folgoluce 5

Ciao a tutti, ma si sa qualcosa dell'uscita in Italiano del quinto folgoluce? Il quarto era uscito in contemporanea all'inglese ma di questo non trovo traccia. 

Se proprio devo lo leggerò in inglese ma mi sono talmente affezionato alle traduzioni italiane di tutti i neologismi di Sanderson che potendo preferirei la nostra traduzione, per altro ottima a mio parere.","2024-12-10T10:21:53.306643Z","[{""start"":52,""end"":112,""text"":""si sa qualcosa dell'uscita in Italiano del quinto folgoluce?"",""labels"":[""Aspettativa""]},{""start"":238,""end"":327,""text"":""mi sono talmente affezionato alle traduzioni italiane di tutti i neologismi di Sanderson "",""labels"":[""Gioia""]}]",63,49.22,"post","2024-12-10T10:21:53.306643Z"

62,"1","Ho controllato anche io oggi, ma nulla, non si sa niente, la Mondadori è stata molto silenziosa al riguardo. Francamente non me lo aspetterei per quest'anno.","2024-12-10T10:22:12.885049Z","[{""start"":109,""end"":156,""text"":""Francamente non me lo aspetterei per quest'anno"",""labels"":[""Aspettativa""]}]",64,91.174,"commento","2024-12-12T14:13:50.233874Z"

63,"1","Il libro più emotivamente devastante che abbia letto in vita mia. Ho pianto tutte le mie lacrime. Ci sono stati certi punti in cui ho dovuto interrompere la lettura e riprenderla solo dopo essermi dedicata ad altro e aver cambiato pensiero. Secondo me una storia tragica, sublime, perfetta nel capire le emozioni umane e nel trasmettere quanto possano essere complicate, specialmente quando sono diverse da quelle che ci aspetteremmo. Per la mia personalissima opinione personale, un capolavoro","2024-12-10T10:24:11.973237Z","[{""start"":0,""end"":64,""text"":""Il libro più emotivamente devastante che abbia letto in vita mia"",""labels"":[""Tristezza""]},{""start"":66,""end"":96,""text"":""Ho pianto tutte le mie lacrime"",""labels"":[""Tristezza""]}]",65,521.283,"commento","2024-12-13T10:52:41.195529Z"

64,"1","Titolo: norvegian woods di murakami

Sono circa a metà libro e lo sto trovando davvero devastante da leggere, ed in senso negativo. Mi risulta davvero noiosissimo e le descrizioni dei personaggi femminili sono così irreali e boriose veramente da farmi girare gli occhi per la noia.

  
edit: mannaggia al cristo sono arrivata alla parte in cui Reiko parla di quello che è successo con la ragazza di tredici anni e sinceramente non ho parole (solo  bestemmie) per esprimere quanto sia becera la scrittura","2024-12-10T10:26:02.519751Z","[{""start"":63,""end"":108,""text"":""lo sto trovando davvero devastante da leggere"",""labels"":[""Tristezza""]},{""start"":132,""end"":162,""text"":""Mi risulta davvero noiosissimo"",""labels"":[""Disgusto""]},{""start"":165,""end"":280,""text"":""le descrizioni dei personaggi femminili sono così irreali e boriose veramente da farmi girare gli occhi per la noia"",""labels"":[""Disgusto""]},{""start"":292,""end"":311,""text"":""mannaggia al cristo"",""labels"":[""Rabbia""]},{""start"":427,""end"":503,""text"":""non ho parole (solo bestemmie) per esprimere quanto sia becera la scrittura"",""labels"":[""Disgusto""]}]",66,328.49699999999996,"post","2024-12-12T14:23:17.778356Z"

65,"1","Non ho mai trovato pesante o noioso Murakami, anzi, ma Norwegian Wood effettivamente è un po' differente da buona parte della sua produzione narrativa.
Ti lascio sotto un commento che avevo fatto per un altro post dove si chiedevano consigli sulla sua opera, magari scopri qualcosa di interessante! 

Il suo capolavoro secondo me è ""L'uccello che girava le viti del mondo"", compendio dell'atmosfera tipica di Murakami, a metà fra nostalgia, sogno e introspezione. Nella stessa vena trovi ""Nel segno della pecora"" e il suo seguito ""Dance dance dance"".
Per una virata verso il fantastico ""La fine del mondo e il paese delle meraviglie"". 

Molto belli anche i racconti, come quelli della raccolta ""I salici ciechi e la donna addormentata"" 

Poi a chi legge il giapponese consiglio sempre la produzione saggistica breve come 村上朝日堂 o 村上ラジオ. Piccoli saggi di poche pagine sulla vita quotidiana a Tokyo. Anche i diari di viaggio in Italia (遠い太鼓) e le collaborazioni con l'illustratore Anzai Mizumaru (ランゲルハンス島の午後) non sono male. Nessuno di questi si trova in traduzione purtroppo.","2024-12-10T10:27:55.169140Z","[{""start"":637,""end"":665,""text"":""Molto belli anche i racconti"",""labels"":[""Aspettativa""]},{""start"":258,""end"":299,""text"":"" magari scopri qualcosa di interessante!\\n"",""labels"":[""Aspettativa""]},{""start"":768,""end"":834,""text"":""consiglio sempre la produzione saggistica breve come 村上朝日堂 o 村上ラジオ"",""labels"":[""Aspettativa""]},{""start"":152,""end"":257,""text"":""Ti lascio sotto un commento che avevo fatto per un altro post dove si chiedevano consigli sulla sua opera"",""labels"":[""Aspettativa""]}]",67,894.741,"commento","2024-12-12T14:35:16.543953Z"

66,"1","Ti capisco, ho avuto un'esperienza simile leggendo questo libro. Sapevo che generalmente le persone lo amano, è uno dei libri più conosciuti dello scrittore e così me lo sono fatto prestare. 

Mi ha messo depressione, eppure leggo libri ""deprimenti"" di ogni sorta. Per me è stato pesante proseguire nella lettura ma ho voluto finirlo comunque.

Tempo dopo ho provato a leggere una breve raccolta di racconti, sempre di Murakami, ""Tutti i figli di Dio danzano"" e ho potuto constatare che sia proprio la scrittura a non piacermi troppo. Ho ritrovato quella pesantezza. Probabilmente non fa per me.","2024-12-10T10:28:54.858004Z","[{""start"":193,""end"":216,""text"":""Mi ha messo depressione"",""labels"":[""Tristezza""]},{""start"":265,""end"":312,""text"":""Per me è stato pesante proseguire nella lettura"",""labels"":[""Tristezza""]},{""start"":535,""end"":565,""text"":""Ho ritrovato quella pesantezza"",""labels"":[""Tristezza""]},{""start"":581,""end"":594,""text"":""non fa per me"",""labels"":[""Disgusto""]},{""start"":487,""end"":533,""text"":""sia proprio la scrittura a non piacermi troppo"",""labels"":[""Disgusto""]}]",68,190.125,"commento","2024-12-12T14:37:40.438219Z"

67,"1","La visione delle donne in Murakami-autore è un argomento a sé... onestamente non ho mai avuto problemi a leggere autori realmente misogini purché riuscissero a tratteggiare decentemente i personaggi femminili (o semplicemente si focalizzassero su quelli maschili)... Purtroppo lui (a prescindere da lui-persona, non mi interessa quello) è proprio incapace come scrittore in quel senso, ha una visione delle donne la cui caratteristica principale è letteralmente essere donna e, come seconda caratteristica, accorgersi continuamente di avere un corpo 😂 il problema è che ne parla, alla terza volta purtroppo è già troppo. 


È una di quelle cose che, se costituiscono un problema (e secondo me lo è, assolutamente), rendono impossibile apprezzarlo. Tanti autori uomini riescono quantomeno a fare lo sforzo, non vedo perché torturarmi con lui ecco.","2024-12-10T10:30:28.275786Z","[{""start"":550,""end"":551,""text"":""😂"",""labels"":[""Gioia""]},{""start"":277,""end"":384,""text"":""lui (a prescindere da lui-persona, non mi interessa quello) è proprio incapace come scrittore in quel senso"",""labels"":[""Disgusto""]}]",69,354.914,"commento","2024-12-12T14:41:39.922717Z"

68,"1","Ho avuto la tua stessa esperienza, soprattutto il fastidio per i personaggi femminili, che come scrive l'altro commentatore non sarebbe così tragico se non ne parlasse IN CONTINUAZIONE.  Comunque devo dire che non mi è dispiaciuto finirlo perché soprattutto verso la fine ero abbastanza curiosa di vedere dove sarebbe andato a parare. Detto ciò, non penso che ne leggerò un altro suo. Ma mi sono proprio resa conto di avere un problema con gli autori giapponesi in generale, dovrei provare con un'autrice.","2024-12-10T10:48:28.798815Z","[{""start"":272,""end"":333,""text"":""ero abbastanza curiosa di vedere dove sarebbe andato a parare"",""labels"":[""Aspettativa""]},{""start"":47,""end"":85,""text"":""il fastidio per i personaggi femminili"",""labels"":[""Rabbia""]}]",70,1390.0369999999998,"commento","2024-12-13T10:58:27.269534Z"

69,"1","Titolo: Santuario di William Faulkner

Mi è stato regalato al mio compleanno questo libro di Faulkner, autore che conosco di fama ma che non ho ancora mai letto. Qualcuno di voi conosce bene già l’autore ed, in particolare, il libro in questione? Se si, che ne pensate? È un buon libro per iniziare ad avvicinarsi a questo scrittore?","2024-12-10T10:48:54.678466Z","[{""start"":162,""end"":246,""text"":""Qualcuno di voi conosce bene già l’autore ed, in particolare, il libro in questione?"",""labels"":[""Aspettativa""]},{""start"":247,""end"":269,""text"":""Se si, che ne pensate?"",""labels"":[""Aspettativa""]},{""start"":270,""end"":333,""text"":""È un buon libro per iniziare ad avvicinarsi a questo scrittore?"",""labels"":[""Aspettativa""]}]",71,23.766,"post","2024-12-10T10:48:54.678466Z"

