"annotation_id","annotator","contenuto","created_at","emotion_labels","id","lead_time","tipo","updated_at"

1,"1","Titolo: Che canzoni mi consigliate?

Io M14 non ascolto musica ma da quando ho cominciato le superiori vedo sempre gente che l' ascolta in corriera. Ultimamente i miei amici continuano ad ascoltare musica anche mentre usciamo e sto cominciando ad incuriosirmi, perciò vi chiedo di consigliarmi una qualunque canzone, band o cantante di qualunque genere musicale. Grazie👍","2024-12-02T15:16:02.157846Z","[{""start"":8,""end"":35,""text"":""Che canzoni mi consigliate?"",""labels"":[""Aspettativa""]},{""start"":226,""end"":259,""text"":""e sto cominciando ad incuriosirmi"",""labels"":[""Aspettativa""]},{""start"":268,""end"":361,""text"":""vi chiedo di consigliarmi una qualunque canzone, band o cantante di qualunque genere musicale"",""labels"":[""Aspettativa""]}]",1,656.481,"post","2024-12-06T14:50:25.319492Z"

2,"1","Io vado pazzo per il symphonic metal

Blank infinity - Epica

Jillian - Within temptation

Da vinci's enigma - Turilli/lione rhapsody","2024-12-02T15:17:32.814225Z","",2,273.83500000000004,"commento","2024-12-12T14:56:51.050250Z"

3,"1","Se ti interessa questa è la mia playlist, all'inizio ci stanno robe che ora ascolto molto meno(tipo i tenacius d), però c'è molta roba che forse ti puo' interessare 

https://open.spotify.com/playlist/1Byf8QlUkc80fQxKZ9mSpI?si=owtCfGrpSpWpzxvbkxHIkg&pi=FovjXI5cTw-TS","2024-12-02T15:20:25.422369Z","[{""start"":120,""end"":164,""text"":""c'è molta roba che forse ti puo' interessare"",""labels"":[""Aspettativa""]},{""start"":0,""end"":40,""text"":""Se ti interessa questa è la mia playlist"",""labels"":[""Aspettativa""]}]",3,426.554,"commento","2024-12-12T14:57:38.225927Z"

4,"1","Ti butto giù qualche nome in base a cosa ascolto io: Linkin park, Korn, Slipknot, Marilyn Manson, system of a down, Metallica, megadeth, Ozzy Osbourne, Rammstein, till lindemann, Hollywood undead, Eminem, smashing pumpkins, Judas priest, Rob zombie, oasis.","2024-12-02T15:29:40.152193Z","",4,48.812,"commento","2024-12-02T15:29:40.152193Z"

5,"1","Titolo: Come migliorare nella matematica

Come si migliora in matematica. Nella esposizione orale di teoremi o di dimostrazioni non ho problemi, ma non riesco a mai a prendere voti soddisfacenti ai compiti scritti. Idee? Sono in quinto scientifico","2024-12-02T15:33:33.333595Z","[{""start"":8,""end"":40,""text"":""Come migliorare nella matematica"",""labels"":[""Aspettativa""]},{""start"":42,""end"":72,""text"":""Come si migliora in matematica"",""labels"":[""Aspettativa""]},{""start"":215,""end"":220,""text"":""Idee?"",""labels"":[""Aspettativa""]}]",5,250.405,"post","2024-12-12T15:02:54.759928Z"

6,"1","Titolo: Consiglio su relazione/lavoro

Mi sento con le spalle al muro, vorrei qualche consiglio sensato per favore.

Argomento: relazione e lavoro

Io (21F) sto assieme al mio ragazzo da più di 4 anni, conviviamo da 2. 
Ho la possibilità di lavorare come mercante da fiera con un’azienda olandese all’estero dove si guadagna molto bene, vitto e alloggio compreso. Per 5 mesi.
Insomma il lavoro è tutto apposto sono affidabili, ho già lavorato con loro brava gente e sin fan soldi e tutto ok insomma.

Io e il mio ragazzo abbiamo avuto una relazione a distanza per 2 anni dove ne abbiamo passate di cotte e di crude, quando finalmente abbiamo convissuto non siam più riusciti a separarci. Relazione sanissima, ci vogliamo un bene immenso e il rispetto/ascolto sono base fondante del nostro rapporto.

Abbiamo entrambi paura dei 5 mesi di distanza. So che sembrano pochi per molti, ma per noi sono tantissimi.
Lui è rattristato all’idea ma mi fa “assolutamente vacci, è importante per te e rispetto questa scelta. Ma preferirei stessi qui” con le lacrime agli occhi 🥺 

Provo mille paure del lavoro (sono un’introversa 🥲) ma anche tanta emozione.

Vorrei andare ma allo stesso tempo ho paura che questo possa compromettere il nostro rapporto perché in questi mesi non potremo vederci (vado in Lapponia per intenderci :/ ) e  di star male a contatto con gente 24/7 per mesi

Sono quel tipo di persona che dopo una giornata di socializzazione, ha bisogno di 2 giorni chiusa in casa da sola (e/o col mio ragazzo) per capirci

Aiuto

Non so cosa dovrei fare","2024-12-02T15:56:28.456247Z","[{""start"":39,""end"":69,""text"":""Mi sento con le spalle al muro"",""labels"":[""Tristezza""]},{""start"":71,""end"":114,""text"":""vorrei qualche consiglio sensato per favore"",""labels"":[""Aspettativa""]},{""start"":800,""end"":845,""text"":""Abbiamo entrambi paura dei 5 mesi di distanza"",""labels"":[""Paura""]},{""start"":908,""end"":935,""text"":""Lui è rattristato all’idea "",""labels"":[""Tristezza""]},{""start"":1181,""end"":1239,""text"":""ho paura che questo possa compromettere il nostro rapporto"",""labels"":[""Paura""]},{""start"":1323,""end"":1370,""text"":""di star male a contatto con gente 24\/7 per mesi"",""labels"":[""Tristezza""]},{""start"":1521,""end"":1526,""text"":""Aiuto"",""labels"":[""Aspettativa""]},{""start"":8,""end"":37,""text"":""Consiglio su relazione\/lavoro"",""labels"":[""Aspettativa""]},{""start"":709,""end"":736,""text"":""ci vogliamo un bene immenso"",""labels"":[""Gioia""]},{""start"":1064,""end"":1065,""text"":""🥺"",""labels"":[""Tristezza""]},{""start"":1068,""end"":1096,""text"":""Provo mille paure del lavoro"",""labels"":[""Paura""]},{""start"":1122,""end"":1144,""text"":"" anche tanta emozione."",""labels"":[""Gioia""]},{""start"":1528,""end"":1551,""text"":""Non so cosa dovrei fare"",""labels"":[""Tristezza""]},{""start"":410,""end"":425,""text"":""sono affidabili"",""labels"":[""Fiducia""]},{""start"":1117,""end"":1118,""text"":""🥲"",""labels"":[""Tristezza""]},{""start"":1146,""end"":1159,""text"":""Vorrei andare"",""labels"":[""Aspettativa""]}]",6,2091.554,"post","2024-12-12T15:02:16.093147Z"

7,"1","Ma lui non può venire con te? Se così non fosse, io da terzo ti consiglio di andarci, ma alla fine la relazione è vostra, quindi fatelo con le vostre scelte.","2024-12-02T16:00:12.659822Z","[{""start"":0,""end"":29,""text"":""Ma lui non può venire con te?"",""labels"":[""Aspettativa""]},{""start"":49,""end"":84,""text"":""io da terzo ti consiglio di andarci"",""labels"":[""Aspettativa""]}]",7,107.259,"commento","2024-12-02T16:00:12.659822Z"

8,"1","Dipende da che punto vuoi vederla, punto di vista della relazione o punto di vista della tua persona (non so se si capisce)","2024-12-02T16:04:33.921626Z","[{""start"":102,""end"":122,""text"":""non so se si capisce"",""labels"":[""Aspettativa""]}]",8,15.339,"commento","2024-12-12T15:03:21.926486Z"

9,"1","Titolo: Analista geopolitico

Ciao a tutti, ho 26 anni, lavoro in banca da 3 anni e sto frequentando la magistrale di scienze politiche e di governo (indirizzo geopolitica). Da poco ho iniziato a collaborare per un centro di ricerca di analisi geopolitica (IARI, istituto analisi relazioni internazionale). Il mio sogno è cambiare lavoro e vivere di geopolitica, una passione che sto coltivando da un po’ di tempo. 
C’è qualcuno che conosce questo centro di ricerca e che può darmi un paio di consigli su come raggiungere questo obiettivo?
Grazie a tutti","2024-12-04T09:52:59.065683Z","[{""start"":416,""end"":539,""text"":""C’è qualcuno che conosce questo centro di ricerca e che può darmi un paio di consigli su come raggiungere questo obiettivo?"",""labels"":[""Aspettativa""]}]",9,203.15300000000002,"post","2024-12-12T15:03:44.383748Z"

10,"1","Titolo: Sentirsi falliti a 45 anni

È così, matrimonio in frantumi dopo anni che ho fatto di tutto per tenerlo in piedi, cosa sbagliatissima, oggi mi ritrovo senza lavoro stabile, faccio assistenza privatamente come OSS, ma il giro non è soddisfacente per nulla, tanta concorrenza, vorrei riprendere gli studi per lavorare dignitosamente. 
Sarebbe opportuno fare scienze infermieristiche, finirei a 50 anni e magari avrei più possibilità da infermiera, oppure mi piacerebbe specializzarmi come OSS e avevo pensato di imparare il linguaggio dei segni, per sordomuti, per lavorare nei centri o nelle comunità, ma ho paura sia troppo di nicchia, e comunque si studia tanto quanto una comune laurea. 
Purtroppo ci sono tanti OSS che non lavorano e ne sfornano di continuo, e di fatto non si ha nessuna specializzazione. 
Ho bisogno urgente di lavorare, avevo qualcosa da parte, ma è difficile mantenere un ragazzo di 14 anni con un mantenimento di 300 euro e con un lavoro come il mio dove appena arrivi a 500 o 600 euro al mese.
Per anno ho lavorato a nero, qui da noi al sud è molto comune. 
Ho un diploma di ragioneria conseguito con 100 e un corso professionale regionale con attestato in grafica. 
Mi sento tanto confusa, cerco una strada concreta. 
Se avete consigli sono graditi, grazie","2024-12-04T10:01:42.572574Z","[{""start"":8,""end"":34,""text"":""Sentirsi falliti a 45 anni"",""labels"":[""Tristezza""]},{""start"":460,""end"":497,""text"":""mi piacerebbe specializzarmi come OSS"",""labels"":[""Aspettativa""]},{""start"":611,""end"":641,""text"":""ho paura sia troppo di nicchia"",""labels"":[""Paura""]},{""start"":500,""end"":564,""text"":""avevo pensato di imparare il linguaggio dei segni, per sordomuti"",""labels"":[""Aspettativa""]},{""start"":1251,""end"":1281,""text"":""Se avete consigli sono graditi"",""labels"":[""Aspettativa""]},{""start"":282,""end"":337,""text"":""vorrei riprendere gli studi per lavorare dignitosamente"",""labels"":[""Aspettativa""]},{""start"":1199,""end"":1221,""text"":""Mi sento tanto confusa"",""labels"":[""Tristezza""]},{""start"":697,""end"":767,""text"":""Purtroppo ci sono tanti OSS che non lavorano e ne sfornano di continuo"",""labels"":[""Tristezza""]}]",10,821.4789999999999,"post","2024-12-12T15:08:48.729050Z"

11,"1","Hai pensato di andare in un centro per l' impiego? Difficilmente ti troveranno un lavoro però potrebbero orientarti sui corsi per il tuo futuro","2024-12-04T10:05:43.572518Z","[{""start"":0,""end"":50,""text"":""Hai pensato di andare in un centro per l' impiego?"",""labels"":[""Aspettativa""]},{""start"":94,""end"":143,""text"":""potrebbero orientarti sui corsi per il tuo futuro"",""labels"":[""Aspettativa""]}]",11,316.121,"commento","2024-12-13T09:59:23.255397Z"

12,"1","non ti scoraggiare, è proprio in momenti in cui tutto sembra stia andando male che possono venir fuori le nostre vere inclinazioni. In questo momento non hai bisogno di dirti che sei fallita. Ti consiglio di farti un giro su linkedin / indeed e provare a cercare i lavori che più ti interessano. se vedi che per il linguaggio dei segni c'è un buon mercato tanto meglio che sia di nicchia. La specializzazione è valore. Ho un conoscente che dopo aver perso il lavoro ha preso una laurea a 55 anni cambiando totalmente la sua vita. Per quanto possa aver valore detto da dietro uno schermo, ti auguro il meglio e so che riuscirai ed essere più forte di tutto questo","2024-12-04T10:10:54.623504Z","[{""start"":610,""end"":662,""text"":""so che riuscirai ed essere più forte di tutto questo"",""labels"":[""Fiducia""]},{""start"":191,""end"":243,""text"":"" Ti consiglio di farti un giro su linkedin \/ indeed "",""labels"":[""Aspettativa""]},{""start"":20,""end"":130,""text"":""è proprio in momenti in cui tutto sembra stia andando male che possono venir fuori le nostre vere inclinazioni"",""labels"":[""Aspettativa""]},{""start"":588,""end"":608,""text"":""ti auguro il meglio "",""labels"":[""Aspettativa""]}]",12,274.134,"commento","2024-12-04T10:10:54.623504Z"

13,"1","sinceramente non vedo la fine di un matrimonio da collegare a un fallimento della vita... cioè ormai sono più i separati normali o di fatto che altro! poi un obiettivo importante come avere un figlio (se mai possa ritenerlo tale, questo dipende) lo hai già raggiunto, a differenza di molti che saranno senza figli e con al massimo un cane...

i soldi vanno e vengono, se ti impegni potrai solo migliorare la situazione economica","2024-12-04T10:15:19.007477Z","[{""start"":382,""end"":428,""text"":""potrai solo migliorare la situazione economica"",""labels"":[""Fiducia""]}]",13,465.91099999999994,"commento","2024-12-13T10:03:37.439094Z"

14,"1","Titolo: Mi hanno invitato a fare un rito cabalistico satanico per far risorgere il duce: che faccio? Accetto?

Testo non disponibile","2024-12-04T10:16:22.374710Z","[{""start"":89,""end"":100,""text"":""che faccio?"",""labels"":[""Aspettativa""]},{""start"":101,""end"":109,""text"":""Accetto?"",""labels"":[""Aspettativa""]}]",14,46.31,"post","2024-12-13T10:04:43.423741Z"

15,"1","procedi pure, voglio vedere la sua reazione quando gli dicono che lollobrigida e salvini sono più pericolosi di lui e hitler","2024-12-04T10:17:12.991091Z","[{""start"":14,""end"":124,""text"":""voglio vedere la sua reazione quando gli dicono che lollobrigida e salvini sono più pericolosi di lui e hitler"",""labels"":[""Aspettativa""]}]",15,47.797,"commento","2024-12-04T10:17:12.991091Z"

16,"1","Titolo: Problemi di coppia

Quando io (78M) ero un giovane e stupido ventenne, ho trascorso alcuni anni spensierati nella provincia di Firenze stuprando, torturando e uccidendo coppiette. Non voglio giudizi da parte dei buonisti su questo, per favore, se non avete vissuto in Toscana negli anni '70, non potete capire. Era semplicemente quello che facevamo a quei tempi. Alla fine sono cresciuto, mi sono sposato, ho avuto tre bellissimi figli e mi sono accontentato di dedicarmi ai miei trofei e alle mie polaroid, e magari di uccidere qualche vagabondo in occasioni speciali.

L'altro giorno, mia moglie (27F) ha trovato il pannello nascosto nel muro della cantina dove conservo tutti i vecchi ricordi ed è andata su tutte le furie. Ho cercato di calmarla, spiegandole che, in primo luogo, erano tutti uomini, quindi non dovrebbe essere gelosa. Secondo, sono tutti morti, quindi non deve preoccuparsi che io la lasci per qualcuno di loro. Terzo, c'erano altri tre o quattro ragazzi che facevano la stessa cosa e si sono presi il merito della maggior parte delle mie uccisioni. Ero molto attento, coprivo le mie tracce, raramente finivo dentro di loro. Non so perché si sia agitata così tanto.

Francamente, mi sento molto ferito da tutta questa storia. Stiamo insieme da quasi vent'anni e lei pensa di lasciarmi per una cosa del genere? Forse avrei dovuto essere più onesto, ma sono stato educato a vedere queste cose come affari da uomini, non come qualcosa in cui coinvolgere la propria signora.

Sono io lo stronzo?","2024-12-04T10:31:54.098436Z","[{""start"":707,""end"":733,""text"":""è andata su tutte le furie"",""labels"":[""Rabbia""]},{""start"":1079,""end"":1096,""text"":""Ero molto attento"",""labels"":[""Aspettativa""]},{""start"":1209,""end"":1253,""text"":""mi sento molto ferito da tutta questa storia"",""labels"":[""Tristezza""]},{""start"":446,""end"":514,""text"":""mi sono accontentato di dedicarmi ai miei trofei e alle mie polaroid"",""labels"":[""Gioia""]},{""start"":1255,""end"":1338,""text"":""Stiamo insieme da quasi vent'anni e lei pensa di lasciarmi per una cosa del genere?"",""labels"":[""Rabbia""]},{""start"":1501,""end"":1520,""text"":""Sono io lo stronzo?"",""labels"":[""Aspettativa""]}]",16,1212.5829999999999,"post","2024-12-13T10:11:21.740484Z"

17,"1","Ciao mi serve un consiglio del cuore perchè ho dei problemi con una persona che per me è tanto speciale... per quanti giorni devo lasciare affamati i maiali? Non deve rimanere neanche la polvere","2024-12-04T10:33:25.377345Z","[{""start"":5,""end"":106,""text"":""mi serve un consiglio del cuore perchè ho dei problemi con una persona che per me è tanto speciale..."",""labels"":[""Aspettativa""]},{""start"":107,""end"":157,""text"":""per quanti giorni devo lasciare affamati i maiali?"",""labels"":[""Aspettativa""]}]",17,87.419,"commento","2024-12-04T10:33:25.377345Z"

18,"1","Ok, OP... 😳, spacchettiamo questo caos assoluto. Prima di tutto, non so nemmeno da dove cominciare, perché questo è fuori da qualsiasi schema. Ma se c’è una cosa che grida problema qui, è il gap generazionale. Tipo, dai, tu hai 78 anni e lei 27! 🤯 Non è solo una differenza di età, è proprio una differenza di epoche.

Facciamola semplice:

1️⃣ Dinamiche di potere – State insieme da quasi vent’anni?! Quindi lei aveva cosa? 18 ANNI quando siete diventati una coppia?! 🧍‍♀️ Tipo, come fa un’adolescente a processare che il suo partner molto più vecchio tiene un kit del killer in cantina? Bro, lei probabilmente pensava di stare con un Babbo Natale in pensione, non... questo.

2️⃣ Sconnessione culturale – Tu giustifichi i tuoi, ehm, passatempi dicendo che erano cose da “altri tempi”. Amico, no. 🚫 La Gen Z non era neanche nata nel tuo “periodo crimini in Toscana” e non è che stiano per aggiornare il loro software per capirlo. Per lei, questa cosa non è nostalgia, è più tipo 🚨 ""Pronto, Polizia?""

3️⃣ La sua reazione ha senso – Lei ha 27 anni. Il suo problema più grande prima di questa scoperta era probabilmente decidere cosa postare su TikTok. Ora deve fare i conti col fatto che il marito ricorda con affetto di non lasciare tracce (PS: “raramente finivo dentro di loro”?! Amico, 🚪👉).

TL;DR: Il problema qui non è solo che hai degli scheletri nell’armadio (letteralmente 🦴). È che voi due venite da pianeti così diversi 🌌 che lei probabilmente non riesce nemmeno a vedere i segnali d’allarme prima di essere travolta dai 🚨 camion dei pompieri.

Verdetto: YTA per il gap d’età. Tutto il resto? 🚀 Diretto al documentario true crime.","2024-12-04T10:42:46.813331Z","[{""start"":480,""end"":588,""text"":""come fa un’adolescente a processare che il suo partner molto più vecchio tiene un kit del killer in cantina?"",""labels"":[""Sorpresa""]},{""start"":1049,""end"":1151,""text"":""Il suo problema più grande prima di questa scoperta era probabilmente decidere cosa postare su TikTok."",""labels"":[""Aspettativa""]},{""start"":1152,""end"":1240,""text"":""Ora deve fare i conti col fatto che il marito ricorda con affetto di non lasciare tracce"",""labels"":[""Disgusto""]},{""start"":593,""end"":660,""text"":"" lei probabilmente pensava di stare con un Babbo Natale in pensione"",""labels"":[""Aspettativa""]},{""start"":246,""end"":247,""text"":""🤯"",""labels"":[""Sorpresa""]},{""start"":221,""end"":245,""text"":""tu hai 78 anni e lei 27!"",""labels"":[""Sorpresa""]},{""start"":367,""end"":401,""text"":""State insieme da quasi vent’anni?!"",""labels"":[""Sorpresa""]},{""start"":402,""end"":468,""text"":""Quindi lei aveva cosa? 18 ANNI quando siete diventati una coppia?!"",""labels"":[""Sorpresa""]},{""start"":787,""end"":796,""text"":""Amico, no"",""labels"":[""Disgusto""]},{""start"":798,""end"":799,""text"":""🚫"",""labels"":[""Disgusto""]},{""start"":1436,""end"":1552,""text"":""lei probabilmente non riesce nemmeno a vedere i segnali d’allarme prima di essere travolta dai 🚨 camion dei pompieri"",""labels"":[""Aspettativa""]}]",18,1139.1680000000001,"commento","2024-12-13T10:18:52.478560Z"

19,"1","Sicuramente credeva che dietro il pannello nascondessi dei soldi, per questo stava con te, brutto maniaco del cazzo, almeno il Pacciani ha scritto le poesie","2024-12-04T10:47:16.096059Z","[{""start"":91,""end"":115,""text"":""brutto maniaco del cazzo"",""labels"":[""Disgusto""]},{""start"":12,""end"":64,""text"":""credeva che dietro il pannello nascondessi dei soldi"",""labels"":[""Aspettativa""]}]",19,57.541,"commento","2024-12-04T10:47:16.096059Z"

20,"1","Torna a criticare i giovani al parco che guardano il telefono e a prendere la tua pensione da lavoratore della UnipolSai se hai veramente 70 anni","2024-12-04T10:48:49.250156Z","[{""start"":0,""end"":62,""text"":""Torna a criticare i giovani al parco che guardano il telefono "",""labels"":[""Disgusto""]},{""start"":63,""end"":120,""text"":"" a prendere la tua pensione da lavoratore della UnipolSai"",""labels"":[""Disgusto""]}]",20,89.698,"commento","2024-12-04T10:48:49.250156Z"

21,"1","Sai qual è il problema? 



Che ni mondo non esiste un po' di bene

Ed ognun' non si considera fratelli","2024-12-04T10:52:12.964996Z","[{""start"":28,""end"":66,""text"":""Che ni mondo non esiste un po' di bene"",""labels"":[""Disgusto""]}]",22,78.592,"commento","2024-12-04T10:52:12.964996Z"

22,"1","Titolo: No, non è un mondo di merda (o per lo meno, non piu di quanto lo è gia stato)

Non c'è il fascismo, non c'è censura, non c'è il patriarcato e non c'è nemmeno oppressione verso le altre idee.

Puoi scrivere di quanto ti facciano schifo i maschi (ma guarda caso ti metti sempre con uno violento lasciando in friendzone/zerbinaggio gente per bene), di quanto faccia schifo Israele (che si difende da terroristi che vogliono solo distruggere e opprimere), di quanto Trump sia contro le donne o lgbt (anche se non c'è una singola intenzione di emanare leggi in tal senso), di quanto il cambiamento climatico stia distruggendo il mondo (però sei disoccupat con moltissimo tempo libero)

TlDr: No, il mondo è sempre stato lo stesso, nel bene e nel male. Non c'è il fascismo, come non c'è stato quando per motivi socio-economici la gente ha da sempre votato a destra.","2024-12-04T11:16:49.729178Z","[{""start"":253,""end"":351,""text"":""ma guarda caso ti metti sempre con uno violento lasciando in friendzone\/zerbinaggio gente per bene"",""labels"":[""Disgusto""]},{""start"":200,""end"":252,""text"":""Puoi scrivere di quanto ti facciano schifo i maschi "",""labels"":[""Disgusto""]},{""start"":355,""end"":385,""text"":""i quanto faccia schifo Israele"",""labels"":[""Disgusto""]},{""start"":354,""end"":355,""text"":""d"",""labels"":[""Disgusto""]},{""start"":387,""end"":457,""text"":""che si difende da terroristi che vogliono solo distruggere e opprimere"",""labels"":[""Disgusto""]},{""start"":460,""end"":503,""text"":""di quanto Trump sia contro le donne o lgbt "",""labels"":[""Disgusto""]},{""start"":504,""end"":573,""text"":""anche se non c'è una singola intenzione di emanare leggi in tal senso"",""labels"":[""Disgusto""]},{""start"":576,""end"":637,""text"":""di quanto il cambiamento climatico stia distruggendo il mondo"",""labels"":[""Disgusto""]},{""start"":639,""end"":686,""text"":""però sei disoccupat con moltissimo tempo libero"",""labels"":[""Disgusto""]}]",23,1429.888,"post","2024-12-04T11:16:49.729178Z"

23,"1","Sarebbe più corretto dire che il ""mondo"", intesto come l'esperienza percettiva degli esseri umani che per noi è tutto ciò che esiste e che conta davvero, diventa inevitabilmente sempre più complesso, tanto nel progredimento e nell'iperdiversificazione dei rapporti socio-economici e geo-politici, quando nell'incremento della nostra capacità di cogliere questa complessità e di viverla in maniera problematica.

Insomma cose che andrebbero insegnate alle elementari, maledetto il Creato e i pubi cesellati degli angeli.","2024-12-04T11:18:07.118957Z","[{""start"":467,""end"":518,""text"":""maledetto il Creato e i pubi cesellati degli angeli"",""labels"":[""Rabbia""]}]",24,74.66,"commento","2024-12-04T11:18:07.118957Z"

24,"1","Israele ha da sempre un piano di ""sicurezza"" che veniva trattenuto da USA e ONU. Questo piano di ""sicurezza"" inizia dalla guerra del Kippur e dall'occupazione tuttora illegale ma fregacazzi di territori non concordati. 

Non friendzonano il tipo perbene, il tipo perbene non si fa friendzonare, se accade vuol dire che si zerbina, ergo mente, ergo è anch'esso un figlio di mignotta. 

Il fascismo c'è. Come quei due pistoiesi venuti a Firenze per sparare agli immigrati. O quelli che hanno bruciato il magazzino di tale casa editrice padovana perché ha pubblicato le memorie di un partigiano.

Per criticare il mondo bisognerebbe prima conoscerlo.","2024-12-04T11:21:58.227709Z","[{""start"":594,""end"":646,""text"":""Per criticare il mondo bisognerebbe prima conoscerlo"",""labels"":[""Rabbia""]},{""start"":343,""end"":381,""text"":""ergo è anch'esso un figlio di mignotta"",""labels"":[""Rabbia""]},{""start"":179,""end"":217,""text"":""fregacazzi di territori non concordati"",""labels"":[""Disgusto""]}]",25,313.389,"commento","2024-12-13T10:24:32.925981Z"

25,"1","Qualcuno faccia spawnare il tizio che su r/CasuaIT continua a spammare che scambierebbe la situazione attuale con gli anni 80. Ho bisogno di una bossfight","2024-12-04T11:22:48.723326Z","[{""start"":0,""end"":125,""text"":""Qualcuno faccia spawnare il tizio che su r\/CasuaIT continua a spammare che scambierebbe la situazione attuale con gli anni 80"",""labels"":[""Aspettativa""]}]",26,89.398,"commento","2024-12-13T10:25:19.232353Z"

26,"1","Sono i palestinesi a difendersi dai terroristi che li vogliono uccidere e opprimere. Il governo di Israele sta commettendo quello che hanno commesso gli stessi nazisti. Adesso puoi continuare a segarti sui bambini mutilati dalle bombe israeliane","2024-12-04T11:23:46.519906Z","[{""start"":168,""end"":245,""text"":"" Adesso puoi continuare a segarti sui bambini mutilati dalle bombe israeliane"",""labels"":[""Disgusto""]}]",27,56.352,"commento","2024-12-04T11:23:46.519906Z"

