"annotation_id","annotator","contenuto","created_at","emotion_labels","id","lead_time","tipo","updated_at"
27,"1","Titolo: Terapia con Prozac (fluoxetina)

Ciao a tutti,  
dopo due anni di terapia con la mia psicologa per depressione (dovuta a lutti ed eventi) e tutto ciò che ne comporta (pensieri suicidari, apatia, fame nervosa, tristezza), ho deciso di accettare la strada degli psicofarmaci, che mi era stata proposta sin dall'inizio.

Oggi è il giorno 17 di terapia con 40 mg di Prozac (fluoxetina). Ho iniziato con 20 mg per i primi 7 giorni, come da indicazioni, per poi aumentare il dosaggio.  
Intorno al settimo giorno avevo cominciato a sentire dei miglioramenti, ma con l'aumento della dose previsto dal piano ho iniziato a stare peggio.

Mi sento in una sorta di modalità ""zombie"": non provo nulla, sono letargico tutto il giorno, ho nausea, zero iniziativa e mi sento sempre piatto.  
So che si dice che il Prozac inizi a fare effetto dalla quarta settimana in poi, ma mi chiedo quali esperienze abbiate avuto voi al riguardo.

Per ora, il Prozac ha spento ogni mia emozione: ha eliminato i pensieri negativi, la bulimia e fame nervosa sono sparite, ma mi sento intrappolato in una sorta di limbo. È come se la mia macchina, con la spia del motore accesa, fosse stata semplicemente spenta... La spia è sparita, sì, ma il motore è fermo, e quindi non posso muovermi.

Ho bisogno di feedback ed esperienze positive: qualcuno di voi ci è passato?","2024-12-04T11:54:10.975654Z","[{""start"":869,""end"":925,""text"":""mi chiedo quali esperienze abbiate avuto voi al riguardo"",""labels"":[""Aspettativa""]},{""start"":1053,""end"":1096,""text"":""mi sento intrappolato in una sorta di limbo"",""labels"":[""Tristezza""]},{""start"":1314,""end"":1343,""text"":""qualcuno di voi ci è passato?"",""labels"":[""Aspettativa""]},{""start"":515,""end"":559,""text"":""avevo cominciato a sentire dei miglioramenti"",""labels"":[""Gioia""]},{""start"":608,""end"":634,""text"":""ho iniziato a stare peggio"",""labels"":[""Tristezza""]},{""start"":637,""end"":679,""text"":""Mi sento in una sorta di modalità \""zombie\"""",""labels"":[""Tristezza""]},{""start"":681,""end"":696,""text"":""non provo nulla"",""labels"":[""Tristezza""]},{""start"":741,""end"":756,""text"":""zero iniziativa"",""labels"":[""Tristezza""]},{""start"":759,""end"":781,""text"":""mi sento sempre piatto"",""labels"":[""Tristezza""]},{""start"":937,""end"":974,""text"":""il Prozac ha spento ogni mia emozione"",""labels"":[""Tristezza""]}]",29,674.107,"post","2024-12-13T10:32:37.577905Z"

28,"1","Lo prendo da 9 mesi. Ho preso 40mg per circa 5 mesi però ultimamente mi aveva fatto diventare una zombie e non so perché. Adesso prendo 20 mg e mi sento più umana. 

Se non va meglio in due settimane, ti consiglio di abbassare la dose (ovviamente parlane col dottore prima). 

Se hai domande mi puoi scrivere in privato :)","2024-12-04T11:55:41.876089Z","[{""start"":57,""end"":105,""text"":""ultimamente mi aveva fatto diventare una zombie "",""labels"":[""Tristezza""]},{""start"":144,""end"":162,""text"":""mi sento più umana"",""labels"":[""Gioia""]},{""start"":201,""end"":234,""text"":""ti consiglio di abbassare la dose"",""labels"":[""Aspettativa""]},{""start"":277,""end"":319,""text"":""Se hai domande mi puoi scrivere in privato"",""labels"":[""Aspettativa""]},{""start"":320,""end"":322,""text"":"":)"",""labels"":[""Gioia""]}]",30,105.989,"commento","2024-12-13T10:32:59.794173Z"

29,"1","Premessa: Gli antidepressivi hanno un effetto diverso da persona a persona.
In ogni caso, io con la fluoxetina mi sono trovata malissimo, il primo mese prendevo due compresse al giorno (aumentate gradualmente) e ho perso completamente ogni tipo di appetito, sviluppando una sorta di rifiuto verso qualsiasi tipo di cibo, sono stata ancora più depressa e le ideazioni suicidarie sono aumentate. Ora, questi sono effetti collaterali comuni nei primi periodi della fluoxetina, ma se ritieni che dopo un mese la situazione non migliori drasticamente, ti consiglio di consultarti con lo psichiatra e chiedere di cambiare farmaco. Ci può stare dovrerne cambiare tanti prima di trovare quello giusto.
Io ora prendo la venlaflexina, che mi ha svoltato decisamente la vita. L'unico contro è che non devi assolutamente dimenticare di prenderlo perché causa assuefazione e i sintomi da astinenza sono terrificanti, quindi se vuoi interrompere devi sempre essere monitorato.","2024-12-04T12:01:30.160662Z","[{""start"":321,""end"":351,""text"":""sono stata ancora più depressa"",""labels"":[""Tristezza""]},{""start"":354,""end"":392,""text"":""le ideazioni suicidarie sono aumentate"",""labels"":[""Tristezza""]},{""start"":729,""end"":763,""text"":""mi ha svoltato decisamente la vita"",""labels"":[""Gioia""]},{""start"":862,""end"":902,""text"":""i sintomi da astinenza sono terrificanti"",""labels"":[""Paura""]},{""start"":258,""end"":319,""text"":""sviluppando una sorta di rifiuto verso qualsiasi tipo di cibo"",""labels"":[""Disgusto""]},{""start"":547,""end"":624,""text"":""ti consiglio di consultarti con lo psichiatra e chiedere di cambiare farmaco."",""labels"":[""Aspettativa""]},{""start"":111,""end"":136,""text"":""mi sono trovata malissimo"",""labels"":[""Tristezza""]}]",31,356.698,"commento","2024-12-13T10:36:48.346806Z"

30,"1","Titolo: Domanda veloce sulla lunghezza percorso psico terapeutico

Salve a tutti, non la tirerò per le lunghe perchè vorrei andare dritto al sodo. 
Quanto dovrebbe durare un percorso psicoterapeutico? C’è un limite oppure è un aiuto che può protrarsi a lungo nel tempo? Lo chiedo perché, senza dare troppi elementi personali della mia esperienza, mi ritrovo dopo 10 anni ad andare ancora dalla psicoterapeuta una volta alla settimana. Premetto che fino a 2 anni fa ci andavo due volte a settimana a causa di forti attacchi di panico e ansia. Ho dovuto diminuire ad una seduta per problemi lavorativi. I miglioramenti ci sono stati ma mi sono sempre chiesto se fosse normale una durata così lunga oppure non possa o sia diventata una “dipendenza” anche se non la vedo come tale.  Ringrazio tutti per un eventuale risposta soprattutto  per chi lavora nel settore.","2024-12-04T12:04:11.227671Z","[{""start"":148,""end"":200,""text"":""Quanto dovrebbe durare un percorso psicoterapeutico?"",""labels"":[""Aspettativa""]},{""start"":201,""end"":269,""text"":""C’è un limite oppure è un aiuto che può protrarsi a lungo nel tempo?"",""labels"":[""Aspettativa""]},{""start"":634,""end"":776,""text"":""mi sono sempre chiesto se fosse normale una durata così lunga oppure non possa o sia diventata una “dipendenza” anche se non la vedo come tale"",""labels"":[""Aspettativa""]}]",32,179.74399999999997,"post","2024-12-13T10:35:25.594866Z"

31,"1","Non so darti molti consigli ma ti dico solo che non è prevista nessuna guerra qui da noi. Non seguire più l'informazione italiana perché è sempre catastrofista pur di fare qualche views in più. Qui c'è spesso la notizia in prima pagina ""la Russia bla bla bla nucleare"" mentre nei giornali del resto del mondo la riportavano in seconda pagina e in maniera meno allarmante (giustamente).
Poi il prossimo anno probabilmente ""finirà""","2024-12-04T12:05:48.962488Z","[{""start"":386,""end"":429,""text"":""Poi il prossimo anno probabilmente \""finirà\"""",""labels"":[""Aspettativa""]},{""start"":90,""end"":159,""text"":""Non seguire più l'informazione italiana perché è sempre catastrofista"",""labels"":[""Aspettativa""]}]",33,140.19899999999998,"commento","2024-12-13T10:37:39.672216Z"

32,"1","Titolo: Sogni e significato

Salve a tutti, recentemente ho fatto un sogno, ne ho un ricordo molto vago, ma riesco a ricordare nel sogno stavo inseguendo una persona (non ricordo chi fosse, ma era una donna) in un ambientazione di fantasia dove alla mia destra avevo un enorme cascata e io correvo radente ad essa sopra una passerella di legno e il mare alla mia sinistra. Ad un tratto mi ritrovo a casa mia nella mia stanza e una donna (non ricordo se era una mia professoressa delle scuole o una donna che conobbi tempo fa, mi da una busta per il mio compleanno (anche se nel periodo del sogno non lo era) e fuori la busta c’era questa frase: “IL SANGUE TI FOTTE LA VITA SE SEI FULMINATO”. Io non aprì quella busta e mi svegliai. Vorrei capire il significato di questa frase e perché mi è stata data da questa donna, probabilmente all’interno c’era il significato o una lettera che mi avrebbe spiegato cosa stesse succedendo, ma io non l’aprì mai. Ho provato a cercare un pò su internet ma non spunta nulla, cosa significa questa frase? 

Ps: nel sogno appena lessi questa frase mi riempì di rabbia, ma non so perché…","2024-12-04T12:09:43.795220Z","[{""start"":1010,""end"":1038,""text"":""cosa significa questa frase?"",""labels"":[""Aspettativa""]},{""start"":1081,""end"":1100,""text"":""mi riempì di rabbia"",""labels"":[""Rabbia""]},{""start"":732,""end"":817,""text"":""Vorrei capire il significato di questa frase e perché mi è stata data da questa donna"",""labels"":[""Aspettativa""]},{""start"":819,""end"":926,""text"":""probabilmente all’interno c’era il significato o una lettera che mi avrebbe spiegato cosa stesse succedendo"",""labels"":[""Aspettativa""]}]",34,219.039,"post","2024-12-04T12:09:43.795220Z"

33,"1","Titolo: Cucinare male...vediamo che sapete fare

Hai mai trasformato un risotto in colla? O una carbonara in una frittata misteriosa? Ho creato una nuova community per noi chef disastrosi, dove condividere i nostri epici fallimenti in cucina e, chissà, magari migliorare (o peggiorare con stile). Che aspetti? Anche le tue peggiori creazioni meritano applausi... o almeno una buona risata! 😅https://www.reddit.com/r/cucinaremale/s/nDkVhXKiQX","2024-12-04T12:11:30.992430Z","[{""start"":49,""end"":89,""text"":""Hai mai trasformato un risotto in colla?"",""labels"":[""Aspettativa""]},{""start"":92,""end"":133,""text"":""una carbonara in una frittata misteriosa?"",""labels"":[""Aspettativa""]},{""start"":297,""end"":309,""text"":""Che aspetti?"",""labels"":[""Aspettativa""]},{""start"":365,""end"":388,""text"":""almeno una buona risata"",""labels"":[""Gioia""]},{""start"":24,""end"":47,""text"":""vediamo che sapete fare"",""labels"":[""Aspettativa""]}]",35,86.546,"post","2024-12-04T12:11:30.992430Z"

35,"1","""Avevo un amico che si chiamava Grumvalski, siamo stati deportati insieme in Siberia. Quando ti portano in Siberia nei campi di lavoro, si viaggia nei carri bestiame e si traversano steppe ghiacciate per giorni e giorni senza vedere anima viva, ci si scalda l'uno con l'altro, ma il problema è che per liberarsi, per cacare, nel vagone non si può e le sole fermate sono quando bisogna mettere l'acqua nella locomotiva. Ma Grumvalski era parecchio timido e già quando dovevamo lavarci in gruppo si sentiva molto a disagio, io lo prendevo un po' in giro per via di questa storia, insomma il treno si ferma e tutti noi ne approfittiamo per andare a cacare dietro al vagone; ma io gli avevo talmente rotto le scatole al povero Grumvalski che lui decide di andarsene un po' lontano, insomma il treno riparte, tutti saltano su al volo perché il treno non aspetta, il problema è che Grumvalski che se n'era andato via dietro a un cespuglio, stava ancora cacando, allora lo vedo correre fuori da dietro il cespuglio, reggendosi con le mani i pantaloni per non farli cadere e tentando di raggiungere il treno. Io gli tendo la mano, ma come lui mi tende le sue deve mollare i pantaloni che gli cadono alle caviglie, ritira su i pantaloni e si rimette a correre e i pantaloni gli cascano tutte le volte che Grumvalski prova a tendermi le mani... Allora insomma che è successo? Niente, Grumvalski è morto di freddo. Arrivederci, arrivederci, arrivederci.""","2024-12-04T12:15:04.563248Z","[{""start"":484,""end"":520,""text"":""in gruppo si sentiva molto a disagio"",""labels"":[""Paura""]}]",36,185.05800000000002,"commento","2024-12-13T10:39:23.795902Z"

34,"1",">allo stesso tempo mi schifa un po' quando gli altri la fanno e anche se sono puliti mi infastidisce l'idea

Ti svelo un segreto.. la fanno tutti.. ma proprio tutti.. non solo gli essere umani.. tutti gli animali gli insetti.. di fatto tutti gli esseri viventi..","2024-12-04T12:12:13.508289Z","[{""start"":19,""end"":61,""text"":""mi schifa un po' quando gli altri la fanno"",""labels"":[""Disgusto""]},{""start"":85,""end"":107,""text"":""mi infastidisce l'idea"",""labels"":[""Rabbia""]}]",37,61.779,"commento","2024-12-04T12:12:39.026799Z"

36,"1","Titolo: Impiego di risorse

Buon pomeriggio a tutti, voglio sottoporvi un pensiero causato dall'avere tanto tempo libero in questo momento.

In caso di chiamata alle armi in un'ipotetica guerra, uno stato, prendiamo ad esempio l'Italia, potrebbe arruolare in modo coatto tutti i personaggi che circolano illegalmente sul suolo nazionale in guerra? Andrebbe contro qualche legge nazionale o internazionale?","2024-12-10T09:50:18.667566Z","[{""start"":237,""end"":347,""text"":""potrebbe arruolare in modo coatto tutti i personaggi che circolano illegalmente sul suolo nazionale in guerra?"",""labels"":[""Aspettativa""]},{""start"":348,""end"":405,""text"":""Andrebbe contro qualche legge nazionale o internazionale?"",""labels"":[""Aspettativa""]}]",38,67.262,"post","2024-12-10T09:50:18.667566Z"

37,"1","Titolo: Quanto sono belle le ragazze

La faccio breve: sabato è stato il mio compleanno ma, per fisse mentali mie, i miei amici non lo sapevano. Mi stavo rompendo le balle a casa, quindi ho deciso di ragiungerli al bar dove erano. Il caso ha voluto che proprio quel giorno uno dei miei amici avesse il dubbio e me lo ha chiesto. Dopo essermi rifiutato un paio di volte, alla fine ho ceduto e, increduli, li ho fatto vedere la mia patente.

Sono venuti quindi uno per uno a farmi gli auguri, scena molto commovente, con parole di incoragiamento e cortesie varie. Il fatto è che quando questa mia amica è venuta a farmi gli auguri, mi ha abbracciato di lato, mi ha detto due cose e poi mi ha dato un bacio sulla guancia. Non me lo aspettavo per nulla e mi sono venuti i brividi al sentire il calore del suo corpo.

Non voglio sembrare un pervertito, perché non c'è uno sfondo sessuale nelle mie parole, ma sono rimasto abbastanza sorpreso di quanto siano mordibe le ragazze. Di quanto sia gradevole il loro odore e di quanto mi sia cambiato l'umore dopo quell semplice bacio. Ma la cosa che mi sorprende di più è quanto peso ho dato alle sue parole.

Le ragazze sono veramente magiche","2024-12-10T09:54:05.899540Z","[{""start"":973,""end"":1010,""text"":""Di quanto sia gradevole il loro odore"",""labels"":[""Gioia""]},{""start"":1077,""end"":1146,""text"":""la cosa che mi sorprende di più è quanto peso ho dato alle sue parole"",""labels"":[""Sorpresa""]},{""start"":1149,""end"":1182,""text"":""Le ragazze sono veramente magiche"",""labels"":[""Gioia""]},{""start"":515,""end"":560,""text"":""con parole di incoragiamento e cortesie varie"",""labels"":[""Fiducia""]},{""start"":719,""end"":748,""text"":""Non me lo aspettavo per nulla"",""labels"":[""Sorpresa""]},{""start"":145,""end"":178,""text"":""Mi stavo rompendo le balle a casa"",""labels"":[""Disgusto""]},{""start"":904,""end"":971,""text"":""sono rimasto abbastanza sorpreso di quanto siano mordibe le ragazze"",""labels"":[""Sorpresa""]}]",39,457.78799999999995,"post","2024-12-13T10:42:01.338406Z"

38,"1","fica sta cosa che farsi piacere la figa è da pervertiti. certo se ti basta così poco più che altro non l hai mai vista… ma non c è nulla di strano. la natura ti ha pensato per quello…","2024-12-10T09:54:47.719660Z","[{""start"":63,""end"":119,""text"":""se ti basta così poco più che altro non l hai mai vista…"",""labels"":[""Sorpresa""]}]",40,124.477,"commento","2024-12-13T10:43:01.187713Z"

39,"1","Non capisco come mai la gente si meravigli del fatto che chi non ha mai la fortuna di ricevere i loro baci e sentire quel calore invece la pensi nella maniera totalmente opposta. Anche io ho avuto questi pensieri quelle volte che mi è capitato di scopare.","2024-12-10T09:57:44.102775Z","[{""start"":0,""end"":42,""text"":""Non capisco come mai la gente si meravigli"",""labels"":[""Sorpresa""]},{""start"":57,""end"":177,""text"":""chi non ha mai la fortuna di ricevere i loro baci e sentire quel calore invece la pensi nella maniera totalmente opposta"",""labels"":[""Tristezza""]},{""start"":179,""end"":212,""text"":""Anche io ho avuto questi pensieri"",""labels"":[""Tristezza""]}]",41,192.523,"commento","2024-12-10T09:58:03.287239Z"

40,"1","Eh si amico mio, sono davvero meravigliose. Un qualsiasi gesto d'affetto da parte di una donna (familiare, amica o fidanzata che sia) ha tutto un altro effetto","2024-12-10T09:58:51.335653Z","",42,43.491,"commento","2024-12-10T09:58:51.335653Z"

41,"1","Non penso ci sia nulla di strano in quello che dici, mi auguro per te che tu possa sentire ancora e molto più spesso quel calore, soprattutto al cuore.","2024-12-10T09:59:35.652616Z","[{""start"":53,""end"":128,""text"":""mi auguro per te che tu possa sentire ancora e molto più spesso quel calore"",""labels"":[""Aspettativa""]}]",43,41.867,"commento","2024-12-10T09:59:35.652616Z"

42,"1","Noooo che schifo bleeeee  
io devo sempre prendere lo sciroppo antivomito prima di uscire perché già so che le incontrerò e mi saliranno i rigurgiti :(","2024-12-10T10:00:48.696792Z","[{""start"":0,""end"":24,""text"":""Noooo che schifo bleeeee"",""labels"":[""Disgusto""]},{""start"":124,""end"":148,""text"":""mi saliranno i rigurgiti"",""labels"":[""Disgusto""]},{""start"":149,""end"":151,""text"":"":("",""labels"":[""Tristezza""]},{""start"":97,""end"":121,""text"":""già so che le incontrerò"",""labels"":[""Aspettativa""]}]",44,110.084,"commento","2024-12-11T09:35:09.646569Z"

43,"1","Titolo: Che si fa questo capodanno

Ho bisogno di aiuto ho 0 idee per questo capodanno. Che si può fare di non troppo costoso e senza andare in discoteca? So che si potrebbe solo stare a casa a chillare ma volevo fare qualcosa di diverso quest'anno visto che ho fatto i 18. Vi prego datemi idee di posti, eventi o consigli su che fare in Italia.","2024-12-10T10:01:49.810011Z","[{""start"":8,""end"":34,""text"":""Che si fa questo capodanno"",""labels"":[""Aspettativa""]},{""start"":88,""end"":154,""text"":""Che si può fare di non troppo costoso e senza andare in discoteca?"",""labels"":[""Aspettativa""]},{""start"":283,""end"":344,""text"":""datemi idee di posti, eventi o consigli su che fare in Italia"",""labels"":[""Aspettativa""]}]",45,56.813,"post","2024-12-10T10:01:49.810011Z"

44,"1","Non iniziate perfavore a rompere col capodanno anche su reddit  che è già il 15esimo post che vedo e già sto evitando i miei amici da 1 mese (3 weeks to go) per cercare di risparmiarmi questo strazio. Vengo su reddit a buttare il tempo extra che ho a lavoro, fate un piacere. Eddai.","2024-12-10T10:02:23.269730Z","[{""start"":0,""end"":62,""text"":""Non iniziate perfavore a rompere col capodanno anche su reddit"",""labels"":[""Rabbia""]},{""start"":276,""end"":281,""text"":""Eddai"",""labels"":[""Rabbia""]}]",46,90.278,"commento","2024-12-13T10:44:38.313558Z"

45,"1","Titolo: Nord vpn vs express vpn

Le usate? Avete avuto modo di provarle? Che idea vi siete fatti? Quale scegliereste?

#software #informatica","2024-12-10T10:03:01.970069Z","[{""start"":33,""end"":42,""text"":""Le usate?"",""labels"":[""Aspettativa""]},{""start"":43,""end"":72,""text"":""Avete avuto modo di provarle?"",""labels"":[""Aspettativa""]},{""start"":73,""end"":97,""text"":""Che idea vi siete fatti?"",""labels"":[""Aspettativa""]},{""start"":98,""end"":117,""text"":""Quale scegliereste?"",""labels"":[""Aspettativa""]}]",47,34.862,"post","2024-12-10T10:03:01.970069Z"

46,"1","Titolo: Penso… quali sono i veri e più urgenti problemi socio-economici che affliggono la nostra nazione.

Sanità, Politica, Tasse, Burocrazia, Lavoro, Istruzione. Idee?","2024-12-10T10:04:20.686197Z","[{""start"":15,""end"":104,""text"":""quali sono i veri e più urgenti problemi socio-economici che affliggono la nostra nazione"",""labels"":[""Aspettativa""]},{""start"":164,""end"":169,""text"":""Idee?"",""labels"":[""Aspettativa""]}]",48,28.19,"post","2024-12-10T10:04:20.686197Z"

47,"1","OP quelli che metti in lista sono effetti, non cause. I problemi sono le cause come l'ignoranza della gente, l'assenza di valori dettata da un voler vivere da furbi anziché far le cose per bene davvero.... in meno parole, i problemi urgenti sono la gente di merda che si riproduce e quella che importiamo e lasciamo stare sul Paese perché c'è altra gente di merda che l'aiuta a venire e restare o procreare impunemente. Qui si tratta e si è sempre trattato di gente di merda. L'italia non è una nazione e non lo è mai stata perché c'è troppa gente di merda e troppa gente di merda diversa in ogni regione. Ricordati sempre che c'è voluto un francese per creare l'Italia moderna e questa ferita non è qualcosa che si rimargina. La nostra nazione non esiste se non sulla carta, pertanto tutti si sentono autorizzati nel fotterla, ovvero nel fottere il proprio vicino e tutti quelli che stanno attorno.","2024-12-10T10:06:26.801486Z","[{""start"":476,""end"":604,""text"":""L'italia non è una nazione e non lo è mai stata perché c'è troppa gente di merda e troppa gente di merda diversa in ogni regione"",""labels"":[""Disgusto""]},{""start"":420,""end"":475,""text"":""Qui si tratta e si è sempre trattato di gente di merda."",""labels"":[""Disgusto""]},{""start"":222,""end"":418,""text"":""i problemi urgenti sono la gente di merda che si riproduce e quella che importiamo e lasciamo stare sul Paese perché c'è altra gente di merda che l'aiuta a venire e restare o procreare impunemente"",""labels"":[""Disgusto""]},{""start"":785,""end"":826,""text"":""tutti si sentono autorizzati nel fotterla"",""labels"":[""Rabbia""]}]",49,233.716,"commento","2024-12-11T09:39:40.247740Z"

48,"1","Titolo: Sono diventato multimilionario prima dei 30. AMA!

Hey Reddit! Ho 30 anni e qualche anno fa ho avviato una mia azienda nel settore petrolifero qui in Italia. È stato un percorso folle, con un sacco di errori e qualche colpo di fortuna.

Non sono nato ricco, ma ho sempre avuto un’ossessione per il lavoro e le opportunità giuste. Ora la mia vita è parecchio diversa da quando ho iniziato, ma cerco di rimanere coi piedi per terra (più o meno 😅).

Se vi siete mai chiesti com’è lavorare in un settore come questo, fare impresa in Italia, o semplicemente cosa faccio nel tempo libero, chiedete pure. AMA!

EDIT: È triste vedere come in Italia l’invidia spesso superi la curiosità. Invece di usare questa opportunità per fare domande utili o imparare qualcosa, molti preferiscono perdere tempo con battute sterili o provocazioni. Per chi invece vuole conversazioni intelligenti: sono qui, approfittatene.","2024-12-10T10:10:28.844449Z","[{""start"":618,""end"":685,""text"":""È triste vedere come in Italia l’invidia spesso superi la curiosità"",""labels"":[""Tristezza""]},{""start"":269,""end"":313,""text"":""ho sempre avuto un’ossessione per il lavoro "",""labels"":[""Paura""]},{""start"":458,""end"":519,""text"":""vi siete mai chiesti com’è lavorare in un settore come questo"",""labels"":[""Aspettativa""]},{""start"":547,""end"":589,""text"":""semplicemente cosa faccio nel tempo libero"",""labels"":[""Aspettativa""]},{""start"":591,""end"":604,""text"":""chiedete pure"",""labels"":[""Aspettativa""]},{""start"":766,""end"":833,""text"":""molti preferiscono perdere tempo con battute sterili o provocazioni"",""labels"":[""Disgusto""]}]",50,347.848,"post","2024-12-11T09:41:31.398040Z"

49,"1","@gferox94 
Così faccio un paio di bei regali ai miei. Vediamo se sei veramente tanto multi

/s ma non troppo","2024-12-10T10:10:44.262632Z","",51,12.701,"commento","2024-12-10T10:10:44.262632Z"

50,"1","Post indirizzato a quelle persone che invece di scegliere l'aiuto professionale preferiscono intraprendere l'autoaiuto. Si invita ad evitare post semplicistici e banali. Sono benvenuti consigli adeguati e incoraggiamenti.

*I am a bot, and this action was performed automatically. Please [contact the moderators of this subreddit](/message/compose/?to=/r/psicologia) if you have any questions or concerns.*","2024-12-10T10:12:16.271503Z","[{""start"":0,""end"":118,""text"":""Post indirizzato a quelle persone che invece di scegliere l'aiuto professionale preferiscono intraprendere l'autoaiuto"",""labels"":[""Aspettativa""]},{""start"":170,""end"":220,""text"":""Sono benvenuti consigli adeguati e incoraggiamenti"",""labels"":[""Aspettativa""]}]",52,52.281,"commento","2024-12-10T10:12:16.271503Z"

51,"1","Non saprei ma anche io, soprattutto sulle questioni lavorative, mi ci rivedo.  
Questa mia fretta o essere irrequieto, mi porta molte volte a commettere dei piccoli errori.

Associo però questa fretta al pensiero di dovermi togliere tutte le incombenze per poter cominciare a vivere (ovvero seguire i miei interesse e fare quello che voglio fare in quel momento).","2024-12-10T10:13:07.672616Z","[{""start"":174,""end"":282,""text"":""Associo però questa fretta al pensiero di dovermi togliere tutte le incombenze per poter cominciare a vivere"",""labels"":[""Tristezza""]},{""start"":80,""end"":171,""text"":""Questa mia fretta o essere irrequieto, mi porta molte volte a commettere dei piccoli errori"",""labels"":[""Paura""]}]",53,69.037,"commento","2024-12-13T10:47:46.666113Z"

